{
  "updated": "2026-10-26",
  "note": "Ориентировочно, ₽ за литр. 95 в России 75 ₽/л (владелец, ответ 20). Остальные цены, включая Казахстан, Грузию и Турцию (v0.2, пересчёт в рубли), вписаны разработкой как заглушки, не проверены: владелец уточняет в админке",
  "defaultFuel": "95",
  "countries": {
    "RU": {
      "92": 70,
      "95": 75,
      "100": 95
    },
    "KZ": {
      "92": 45,
      "95": 55,
      "100": 70
    },
    "GE": {
      "92": 100,
      "95": 105,
      "100": 120
    },
    "TR": {
      "95": 115,
      "100": 125
    }
  }
}
